nah, it's just the flu . Hate being sick haha
Got my flu shot and I can't even function I hate being sick
And I've never gotten this flu vaccine before... if the vaccine was stronger meaning I actually got sick ... Would have told em no
So went to the doctor this week...& had to get the flu shot to protect my child from getting sick I really didn't want to do it
I have only been sick with the flu once in the past decade that I can remember.
Q: What do you call a half-dozen Indians with Asian flu ? A: Six sick Sikhs (sic).
Bae is sick . Just flu and he is soooooo acting like a baby. Gosh!
I'm sick with pen flu
This flu make me sick !
me: is sick with the flu me: suffers through the beep test & squats 125lbs
I should get the flu shot before kids at work start to get sick .
All this brouhaha over Mrs.Clinton working while having the flu . None of you worked while sick ? Okay, then. Sit your ass down and shut up.
Cold and Flu — feeling sick
holy shit why did i get the flu shot i always get sick from it
When you get the flu shot to prevent getting sick but then you react to the flu shot and don't feel well anyway <<<
Lowkey feeling sick .. & i got my flu shot yesterday
my bank account is sick it has the flu
she eas sick during legion speech she had the flu a summer cold. What has happen to media unable to use commonsense.
I'm catching the flu I'm sick of these bitches
Pretty sure I got the flu ... Woke up sick as fuck
makesmesick Can't believe i'm getting sick and not talking bout my flow lol.....no for real why the flu makesmesick
Can you recognize sepsis symptoms? You have to tell them apart from flu symptoms, here is how ---> http:// ow.ly/Tnw13048IA7 #sepsis #sick
Mom has the stomach flu and I'm walking around the house cleaning every little thing because I can't get sick I want to go out this weekend
Now why would you say that? I get flu shots all the time to prevent getting sick .
Already sick of flu and the vaccs only arrived today. Templates, protocols, reports, bunting . . . #PrimaryCare
Ok so I just got my flu shot and I already feel sick
FUCK, I gotta get a flu shot for my program. I have never gotten one and wasn't planning on it! Tea is all I need to not get sick .
Every year in September I get the flu . It is here and I am a sad girl. #letmevent #sick
Why do i get sick so easily? I was sick 3 weeks ago for 2 weeks. And now the shitty flu is back.
dEs im sorry to tickle ur peach but im sick w some stomach flu shit but i might be baxk tmrw????
Sick with the flu ? Sick muscles maybe.
1st flu shot for me ever was 2009 i was sick for a mth Not gonna do it...wouldnt be prudent""
So sorry you're sick ! This time of year (kids back to school but no flu shot yet) is just the worst. Hope you're better soon
Screw the flu shot. Everyone I know that gets it gets sick ! https:// twitter.com/noltenc/status /775746928617328640 …
Allergy sick . Not cold/ flu sick . #notcontagious
I guess I might have the flu ? I haven't been so sick in years. Cats are being good buddies though and the apartment is breezy and bright
Got our flu shots today! I'm more worried about patients getting sick than me. So if one kid is helped, great! pic.twitter.com/z6ZkHTh1zR
Been off sick today 'cos of the flu & have binge watched most of The Night Of. So glad it's as stellar as everyone's been saying it is
Flu just got better but now its the throat that's killing me.Cats just got sick .What more challenges do I have to face in the next few days?
How much of a risk is flu to #kids ? This doesn't include the 20,000 *yearly* who spend time very sick in hospital. pic.twitter.com/sd4RDPbboZ
I don't need a flu shot . I haven't got sick in a while
Getting sick after I got the flu shot. What's up with that
but the person with the flue still has to put effort into recovery, lest they get others sick . You want the flu ?
I got the flu shot but I was already getting sick so..
yea I been sick hun. Think stomach flu . Not sure.. and in wheelchair..
Dengue last week and Flu this week. Falling sick at the wrong time sucks
I hv a feeling of sick again, serious one but not only like flu . Bless me
And off to the doctors I go.. why can't this flu just go away already.. sick of feeling like ass
the only perk of being sick is being able to watch dan's liveshow. so proud. go the flu !
Minutes into getting my flu shot and I'm already feeling sick lol
I always thought wook flu was just what you called that sick feeling after a fest lol
I always thought you got the wook flu from doing drugs, and I did 0 drugs. I just got sick as shit from the wet freezing mud.
a conspiracy that she is terminally ill, not sick with the flu or pneumonia.Christ your daft
Bitch need I remind you that I don't need the fucking swine flu to be a sick pig
Home sick with the flu , a great time to get to know my new #tarot deck. #pagan #witch #shaman pic.twitter.com/IupjoxFp3U
I caved. I got my first ever flu shot today. Here's hoping I don't get sick like I did last year!
Sorry I missed you. Midway through yesterday feeling a little sick turned into the worst stomach flu I've ever had. :(
Im sick ...feel like am about to die...think i have like a new Killer strain of The Flu Swine flu mixed wit Bird Flu & a pinch of The Zika
yuuuup, but also, people I know with little kids are constantly sick . Flu for 3 weeks, tonsillitis etc etc. Nah fuck, never.
When my son first got sick I was sure it was a flu . He had stomach aches and didn't want to eat so I thought it would pass.
worked with people who travelled a lot for their work. they were constantly sick . known as hotel flu ". shaking hands, etc"
@beate_dizon i am sick / flu =(
Cold/ flu and allergy season is approaching! Check out this Sick Day Survival Kit + Enter to win a $250 Sam's Club... http:// fb.me/86feaIsb4
4:45 lmao. i feel v sick rn tho i think i may have the flu :((
I'm sick lil b* got the flu
Don't be like #Hillary . Read my article on How Not To Get Sick This Cold & Flu Season http://www. timgamble.com/2016/09/how-no t-to-get-sick-this-cols-and-flu.html … #tcot #politics #Trump #ccot
This flu have me a way, fever, pain in my joints and runny nose. — feeling sick
I only get sick like once a year but when I do it's the worst fucking flu ever
Flu & colds get passed along because no one can stay home. No one has that much sick leave. Companies aren't staffed for folks to get sick .
got my flu shot and I can't even function I hate being sick
When you get the flu even though it's barely flu season #sick #gross
Then that time when George HW Bush, sick with flu , hurled and fainted at a 1992 state dinner in Japan. http:// tinyurl.com/hfsgwvw
I feel like I'm sick at least once a month is this normal?? I swear I JUST had the flu and now it's a cold
Why can't just one cold and flu season pass without me getting sick ?
It is a year to the day when I got the flu that turned into lupus and I'm getting sick again why am I so predictable
hope this flu shot ain't gunna get me sick
twice I've been really sick -- once with the flu -- but could not take a sick day due to immovable deadlines.
I got the flu shot bc my doctor recommends it for preggo bitches. But last time I got it, I got horribly sick . I hope I'm okay this time.
My last med.. I'm still sick .. #flu #notfeelingwell https://www. instagram.com/p/BKTIwRKjHfW/
Feeling sick ... Activating Man Flu " in 5.4.3.2.1............. WAAAAAAAAAAAAAAAAAAAAHHHHHHHH!!!!!!!!! Come take care of me!!!!!!! lol"
I'm sick today flu
Is you sick from the dick or is it the flu ? Excellent
What's the purpose of a flu shot if it's stil gonn make you sick ???
@mjwatts1983 @Salon @embeedub Exactly an entire household can be sick with the Flu n the Woman has to push through it 4family
I bed right now due to flu ... I don't get sick until I start going to school.
So sick . Flu ? What the heck.
than the flu or even a cold. Most immune systems destroy the bacteria before it can make them sick .
Flu go away. :.( I still need to finish some stuffs.. 󾍀󾌮 — feeling sick
OMG it's 90F/32c outside and I'm in bed being sick having flu is just stupid pic.twitter.com/rsuwibmelg
Flu sick pic.twitter.com/wYQ6uxI7xO
Flu is making me so sick ugh
Ok so @HillaryClinton is human. She's been working hard, and traveling all over. I am 40 and healthy. I too have been ill, flu & home sick !
I feel so sick with all these flu and fever and headache
He has a cold and gets me sick ... I pretty much end up with the flu ...I hate him
In my 22 years of existence, I've never heard him saying he's sick . He doesn't even get flu but he's forever walking barefoot
If your cold symptoms came on suddenly and you feel very sick , it’s probable that you have a flu
#MedicalNews : Clearly #HillaryClinton has the #flu . Note how her name flows better without  sick " in front of it. https:// twitter.com/Cernovich/stat us/775103823425605632 …"
Omg I feel so sick ! Feels like flu ?? Quick get me to where my grandkids live!" Said no loving Grandma EVER!"
Q: What do you call a half-dozen Indians with Asian flu ? A: Six sick Sikhs (sic).
Funny thing is, even if i start today to get sick with end of summer flu + its 34 degrees outside..this little... http:// fb.me/35VuYARPC
Funny thing is, even if i start today to get sick with end of summer flu + its 34 degrees… https://www. instagram.com/p/BKS7S3Ph6VH/
Q: What do you call a half-dozen Indians with Asian flu ? A: Six sick Sikhs (sic).
Q: What do you call a half-dozen Indians with Asian flu ? A: Six sick Sikhs (sic).
Trying to work whilst sick with the flu is not fun. What is fun is that I get to use the word whilst"."
parang you've been sick for so long! That could not be just your run of the mill flu . Get well soon!
I'm getting the flu ....but I have an evening shoot and just got an audition.Aint nobody got time to be sick when you have work to do
arrrgh you at it again Shan!! I'm about getting the flu now! Baah I don't wanna be sick ! Blaargh
Q: What do you call a half-dozen Indians with Asian flu ? A: Six sick Sikhs (sic).
you must of caught a Lil flu from being sick of the bullshit
Im getting sick of this flu
I was sick with the stomach flu
Sick and tired of this stupid flu .
im fucking sick ... i hate flu season
are you still sick ? :( are you sure it's a cold and not the flu or mono?
Eish le Flu iza ngama kakanas — feeling sick
Many people many colors shapes & sizes Some have cancer others The flu some live long Some live short sad we have Some who are outright sick
If people could stop informing me that I look/am sick , it would be great. I have a flu and a mirror, I'm aware.
fresher's flu , gone back to college and got sick . Same as when I used to go back to uni
I get embarrassed about feelin sick even if it's just flu I #Hide &Cough but I've come 2accept dat d human body goes thru constant changes...
sick ok jangan flu Yang rabak sudah!! Goodluck though
Yoga for when you're sick with a cold or the flu - http://www. yogaposestoday.xyz/yoga-for-when- youre-sick-with-a-cold-or-the-flu-21/ … #yoga #fitness #health pic.twitter.com/M8PYrxiU3x
http:// boo.dance Cheers are paintballs until Boo Crew ruins it! I'm still flu sick ! Let's sweat it out! pic.twitter.com/Fb487M44Gu
Q: What do you call a half-dozen Indians with Asian flu ? A: Six sick Sikhs (sic).
Currently sick with the flu , binge watching @PLLTVSeries . pic.twitter.com/2fU8u9IA6L
Maybe I'm sick because I didn't get the flu shot this year
I'm flu game sick
@bakuchessol2016 R11 LIVE: Sick w/ flu can't sleep. So hey, watch the last rd. live! #whoneedssleepwhenyouhavechess | https:// chess24.com/en/watch/live- tournaments/42nd-chess-olympiad-baku-2016-open/11/1/1 …
Flu berat Ketika badan terasa panas tapi udara diluar dingin dan batuk ga… ♫ 사랑이 아프다 Love Sick by Hwanhee — https:// path.com/p/12e21y
same. I mean I actually get sick all the time but it's never the flu
well yeah. i had a flu . and it sucks. i don't want to get sick ever in my life again https:// twitter.com/HTTPPUFF/statu s/775565732272758784 …
Still awake, have class tm and work all day, and I'm sick w the stomach flu it's fine love my life love being an adult
To get a flu shot and get sick , or no flu shot and chance getting something really nasty...i hate this battle every fall..
Ash feels sick for ONE day.. And all of a sudden she has Zika, hypothermia, the flu , her insides are bleeding, her legs Gona fall off.
and everyone else on the planet it's flu season! The whole house over here is sick
Ill? I'l is the flu , you call in sick cuz you're ill. Not, I need help off a curb.
T.T #flu — feeling sick
Ayikho le yakho... flu ? RT @NanaisTHEname : I'm sick again. Smh
I am so sick . I lost 10 lbs this month. I can't eat much and I just got the stomach flu . Joy!
Fuck this flu season i hate getting sick
Having a bad due coughing, flu nose and sore throat . Can't maintain on the hot weather make me fall sick today
I'm feeling sick and I ain't got the flu girl I'm missinnnn youuuu
Even if Hilary is not sickly off some nasty Parkinson's Drug..er.. Flu or whatever...she is still a sick puppy. @realDonaldTrump
if your talking bout Mills he just got activated, He was sick with the flu , lost weight had not pitched in 2 wks
I'm love sick like it's just the flu
I had ginger ale when I was sick with the flu a few months back but I don't count that
There's a reason that the flu vaccine are a person unattractive, but not debatable whether the flu shot. Obsomeonely if you're sick . Fame.
The flu is for sure going around cause everyone is sick
I want to be this guy. Being sick fuckin sucks. I want my head removed. #sick #flu #thedionshow … https://www. instagram.com/p/BKSBENhgaS_/
Tim Gamble: How Not To Get Sick This Cold and Flu Season http://www. timgamble.com/2016/09/how-no t-to-get-sick-this-cols-and-flu.html?spref=tw …
Work made us get our flu shots a few days ago and now I swear I'm getting sick .I have all the luck.
Feeling #sick & #tired ? Here are 4 tips to improve #cold & #flu #symptoms ! @pamela_a_allen #30SecondMom #health https:// 30secondmom.com/tip/11251
Sick ,Lil bitch got tha Flu
girrrrrrl. it would've been a wrap for me, I all of a sudden can't make it to class sick with the flu tbh
Idk if it's this flu shot I got last week or if it's just time for my seasonal allergies that has me sick like this
It's stupid how for nursing you have to get the flu vaccination. Like the only time I get sick is when I get this shot...
I've gone to work w/ stomach flu Should've called CNN Could've made some great headlines woman works while sick " Oh wait THAT'S WHAT WE DO"
Don't be like #Hillary . Read my article on How Not To Get Sick This Cold & Flu Season http://www. timgamble.com/2016/09/how-no t-to-get-sick-this-cols-and-flu.html … #news #politics #Trump #gop
feel so fucking sick , if I have the flu I will actually cry so hard
Dan sepertinya bakal kena flu ini #fuck #sick #shit
Really feeling sick right now. It's not a flu or anything so I can go to school. Just watch out for my snout attacks
Yes ! But if you're still sick try and rest ;n; is it flu or stuff ?
My bed is full with crippled tissues and bogeys. Haaah flu and cough are horrendous. I don't like being sick .
Dear Flu Season, Why you make me sick ? Go away! I'm working
My worst enemy right now is the flu . And it got me good. #hate to be sick 󾌮
#Sick ? #Cold ? #Flu ? #Allergies ? #Sinusitis ? #SinusInfection ? Get #EucalyptusMint Tarts. http:// dld.bz/eSekr pic.twitter.com/UMwZTk3TtM
Yoga for when you're sick with a cold or the flu - http:// yogaphotos.xyz/yoga-for-when- youre-sick-with-a-cold-or-the-flu-20/ … #yoga #fitness pic.twitter.com/C9hjL0Bz6R
ur sick lol its the flu
Man I hate seeing birds catch the avian flu ; makes them sick af pic.twitter.com/fxmxS8Bf8t
When your mom tells the kids they have to get their flu shots just so I don't get sick and end up in the hospital, I feel the love
Need a Dph flu a beat me — feeling sick
Never fainted in my life, but I've went to my knees plenty of times b/c of being sick . Sinus/ flu /pneumonia can kick your butt!
I was sick 2 weeks ago all y'all better keep the fuck away from me w this damn flu .
I've been getting flu shots for years & years - rarely get full sick .Hardly ever need abx. Colds don't last long either.
omg haha. I felt sick on my birthday about 3 weeks ago. But I never blew the flu on a cake before. First time for everything
Just like every woman on the planet. Men are wimps! Especially sick poorly man flu men. https:// twitter.com/tvmojoe/status /775487545362690048 …
I'm also getting sick . It's flu season is nearing. People are starting to wear sweaters. And turning off air condition airs.
Horrible way to start the week feeling sick . Chilly, feverish, nausea, giddy, flu ... Nooooooooooooo
ahhh sick lil bitch got the flu
damn how many Americans hav had the flu and did not get out od bed give her ctedit she made it out of her hm sick and yall.still bit@##
My arm is killing me like ive been lifting all day stupid flu shot, i BETTER not get sick
@PEEPSPOLITICAL CLINTONS FLU COOP DIAGNOSED & CONTAMINATED ALL REPORTERS GOT SICK BY CLINTON > BLEACHED & HAMMERED?? https:// lnkd.in/dsNMvKm
gotta flu shot the other day and I'm sick ?
but I'm sick as fuck bc of this stupid flu shot SMFH
there must! My mom just got over the flu , kids and workers at work are all sick too
@CNN I want every reporter to note on every sick day, flu day, bout of pneumonia, colonoscopy etc. because it might impact your reporting!
omggggg i get sick w the flu and now im like 5 months behind in school
I'm excited for hoco, but I don't think everyone's ready to get the flu the next day like last year STAY HOME IF YOURE SICK
What does Hillary being sick have to do with stamina? Michael Jordan caught the flu during the playoffs. Did he not have stamina? @CNN
Like  Flu sick "'or "cold/allergy sick ?""
I'm sick lil bitch got the flu ahh
Being sick with with the flu is a bitch esp in this hot beautiful weather!
Also, get a flu shot if you're around people with compromised immune systems or just don't want to get sick ! https:// twitter.com/humidbeing/sta tus/775486637073543169 …
I've gone to school &/or work with mono, bronchitis, sinus infections, colds, flu , broken bones. Sick leave was not an option.
Cold and flu sucks #bleh #sick
I'm feeling so sick , I think I have the flu . Somebody pray for me󾍛 I can't remember the last time I felt this bad!󾍀󾍀󾍀
NEW! How Not To Get Sick This Cold and Flu Season http://www. timgamble.com/2016/09/how-no t-to-get-sick-this-cols-and-flu.html … #prepper #tcot #survival #preppertalk #health #family
i got my flu shot today and if i get sick ima be pissed
The media has no common sense. She has pneumonia, not cancer. I don't alert friends & family when I'm sick w/ pneumonia/ flu /cold.
This is not my greatest day. I'm pretty sure I have the flu . I'm going to bed early tonight. #Monday #sick
Since flu season is coming, maybe it's time to talk to how to stay safe from it & pneumonia (given others sick in Clinton camp). @CNN
Lol school starts next week and I'm 62% positive that I am sick with the flu
its so ironic how im give flu shots at work but im sick as fuck and i proba have the flu
I swear these guys came back from ATL with the Wook flu ... Shit I didn't go to ATL and I'm sick now
When U catch your hair blowing in the wind. My colorist game is sick like the flu 󾌮 not just a makeup artist... http:// fb.me/5X8ImeKtB
Speaking of no sick days for Mommy, it's been a rough day....feels like flu .
@cnn @outfront Bill Clinton is certainly referring to Hillary getting sick with flu /dehydration and fainting in 2012.
@egumeny read the @nytimes article. Well done. Home sick with the flu , want to buy everything you have ever written.
((I kinda want to get sick (( flu and all that)) just so i could watch mamamoo vids all day ugh))
Q: What do you call a half-dozen Indians with Asian flu ? A: Six sick Sikhs (sic).
Stop it for goodness sakes! If she has a cold or flu so what! Getting sick of this nonsense! None of u talking about her campaign!
. @AdamBaldwin so no more infectious pneumonia? I thought Ol' Chuck said he was sick now w/ the Hillary pneumonia flu ?
Sick Hillary told to drop out.. wake up.. (unresponsive) http://www. thepoliticalinsider.com/hillary-clinto ns-inner-circle-just-gave-her-the-worst-news-possible-whoa/ … Meanwhilst.. Bernie gets a flu shot and takes Vitamin C
Im literally going through the same thing right now,my alleriges were horrible Mon,by Wed I was full blown flu . still sick now.
After having the flu , I don't ever want to be sick again
And then same day holds her grandchild yeah she sick but not a flu ,more like Parkinson's https:// twitter.com/RealJamesWoods /status/775359991498670081 …
Most ppl go to work sick w/colds/ flu etc., that's how illness spreads. This is ridiculous. #hardball #ImWithHer
Hillary's pneumonia is irrelevant. People do get sick with colds, flu , pneumonia it doe not mean you can't govern. https:// twitter.com/ThisWeekABC/st atus/775465167484313604 …
Feeling sick ? Have the flu ? Your #yoga practice can save you. https://www. youtube.com/watch?v=TEkV8E vIW80 … pic.twitter.com/KZEJuIykXH
I am so sick and tired of Clinton's lies, pneumonia, bottle flu more like it
Flu Melanda .. !! — feeling sick
#Pneumonia Isn't Flu as #MSM Seem to Think~ #Hillary has been Sick for LONG Time http://www. people.com/article/hillar y-clinton-staff-sick-pneumonia … #msnbc #foxnews #nyt #npr #cnn #nbc
I've never gotten the flu shot before but today I decided I would get it. It hurts!!! better then getting sick though!
i'm sick , i can't believe this it's this damned weather; either is windy and cold or it's sunny and hot, i was doomed to get this flu
I'm getting sick , and it ain't the flu .. I'm missing you boy.
I get so lazy when I'm sick then I remember CM Punk wrestled a 5 star 30 minute match against John Cena on RAW while he had the flu & jetlag
NEW! How Not To Get Sick This Cold and Flu Season http://www. timgamble.com/2016/09/how-no t-to-get-sick-this-cols-and-flu.html … #prepper #ccot #survival #preppertalk #health
I better not get sick from this flu shot
I got a flu shot the other day cause I'm like 'let me get this before OOW and DF so I don't get sick from those thousands of dirty ppl'...
why did I have to get the flu & be too sick to get out of bed on Eid
wth i just felt so sick feeling during work hanna says she startint to get the flu she thinks and i might have gotten it from her
How many of us have caught the flu or other virus from a co-worker due to limitations of paid sick leave?
Pregnant women can lower risk of birth defects with flu shot, March of Dimes says: Getting sick with the flu early… http:// m.tbnn.it/MFSxCz
Each year thousands get the severe flu . Why would the Clinton campaign force a sick 70-year old to a fundraiser? pic.twitter.com/o0ezdN9lkw
I'm going to be so irritated if this flu shot makes me sick
I left my house in seemingly good health & by fifth period felt like I had the flu . My students aren't even sick yet & I've caught a cold
I hope it clears soon. @FullyNocturnal is sick too. My daughter says she has been vomiting last night and flu suffering 6 weeks.
Im #sick got the #flu #sinus -infection #dying over it !
I am so sick like the flu
Work newsletter says to lower your flu risk by avoiding people who are already sick . Thanks tips
I'm sick I have the flu
good try....but she is really really sick ... you can tell by a lot of clips of her. no pneumonia or flu ! Parkinson! https:// twitter.com/moneyries/stat us/775429568823955457 …
Sept Is one of the worst months for pneumonia/ flu /allergies.With the grueling schedule Hillary keeps-no wonder sick https:// twitter.com/ddale8/status/ 775334387135180800 …
Swagg so sick Gave The whole Game A Flu pic.twitter.com/bLKxNTC4uE
Some get #drop post event/con. Me, I get sick with cold/ flu /plague dujour. I'm starting to think I'd prefer regular ole post-event/con-drop.
Yo. I better not get sick bruh. I got a live MMR & Flu virus in me rn.
flu going around. I got sick last week sat on my ass and ordered like 80 worth of uber eats
I'm getting a flu shot so I'll have fun being sick for a month
bring some flu medicine too. Be prepared to get seriously sick .
The flu - 405pm feeling great, 406pm sick as kennel dog
why can't colds just be like the flu and go away after a day or two this fucking sucks i feel like i've been sick forever
// so I'll be off Twitter due to my sickness... Sorry I've been sick from things do know the cause yet. It's obviously not the flu either.
It's like I get over the flu && I get sick again
Gosh! 3 days of being sick with a cold similar to the flu in this heat is crap!!
We are at the CUSP of Flu Season! You call the shots - protect yourself before you get sick ! @NevadaDrugCard pic.twitter.com/z6iJz6v3Da
Been off sick for almost a week now with the flu has given me a lot of time to think about what I want in life Important changes coming soon
Cold and flu season is right around the corner What can you do to support a healthy immune system? #flu #cold #sick http:// snip.ly/l3it4
. @CNNPolitics @camanpour A sick day is a cold or the flu , not collapsing on the street. You can't really pretend to be this dense.
Ah. So Clinton is one of those awful persons who is sick but comes to the office 'cause she's tough' and continues to give EVERYONE the flu .
Do flu vaccines really work? I can't remember the last time I got one and didn't get sick
Its like all of Kempner got the flu ! we all gettin sick !
flow sick like the flu pic.twitter.com/F5RvdOAdNg
We all get sick sometimes, and bronchitis resulting from a cold or flu is pretty common; so, why the secrecy if that's true?
Can't wait to get home from work & sleep. This flu is killing me. Wish I felt a bit more crappy so I coulda called in sick to work
